{
  "dataset_name": "ESA WorldCover 10m v200 — South Asia",
  "dataset_type": "landcover",
  "source": "ESA",
  "source_url": "https://esa-worldcover.org/",
  "source_reference": "ESA_WorldCover_10m_2021_v200",
  "file_path": "../dataset/raw/landcover/ESA_WorldCover_10m_2021_v200_S06E077.tif",
  "file_format": "GeoTIFF",
  "crs": "EPSG:4326",
  "temporal_start": "2021-01-01T00:00:00Z",
  "temporal_end": "2021-12-31T00:00:00Z",
  "version": "v200",
  "ingestion_options": {"buffer_degrees": 0.01}
}
